code,display,definition
1853451000004100,Gleason scoring system for prostatic cancer composite method,Gleason scoring system for prostatic cancer composite method (staging scale)
1853441000004100,Gleason scoring system for prostatic cancer by highest grade nodule,Gleason scoring system for prostatic cancer by highest grade nodule (staging scale)
1843201000004100,Gleason scoring system for prostatic cancer by largest nodule,Gleason scoring system for prostatic cancer by largest nodule (staging scale)
1812481000004100,International Society of Urological Pathology prostate cancer staging system,International Society of Urological Pathology prostate cancer staging system (staging scale)
1104421000000100,Alert Confusion Voice Pain Unresponsiveness scale,Alert Confusion Voice Pain Unresponsiveness scale (assessment scale)
1104061000000100,Royal College of Physicians NEWS2 (National Early Warning Score 2),Royal College of Physicians National Early Warning Score 2 (assessment scale)
905271000000101,Childhood Asthma Control Test,Childhood Asthma Control Test (assessment scale)
738521000000108,"PUFA (pulpal involvement, ulceration, fistula and abscess) index","Pulpal involvement, ulceration, fistula and abscess index (assessment scale)"
568241000005104,"TWEAK (Tolerance, Worry, Eye-opener, Amnesia, K/Cut down) questionnaire","Tolerance, Worry, Eye-opener, Amnesia, K/Cut down questionnaire (assessment scale)"
481281000000100,PCL-5 - post-traumatic stress disorder checklist for DSM-5 (Diagnostic and Statistical Manual of Mental Disorders - Fifth edition),Post-traumatic stress disorder checklist for Diagnostic and Statistical Manual of Mental Disorders - Fifth Edition (assessment scale)
459231000124102,Sequential Organ Failure Assessment,Sequential Organ Failure Assessment (assessment scale)
145021000000101,London Measure of Unplanned Pregnancy,London Measure of Unplanned Pregnancy (assessment scale)
73041000052103,EuroQoL five dimension five level questionnaire,EuroQoL five dimension five level questionnaire (assessment scale)
57671000052108,Chronic Obstructive Pulmonary Disease Assessment Test scale,Chronic Obstructive Pulmonary Disease Assessment Test scale (assessment scale)
35181000087108,Duke treadmill score angina index,Duke treadmill score angina index (assessment scale)
7121000122100,Pain Assessment in Advanced Dementia Scale,Pain Assessment in Advanced Dementia Scale (assessment scale)
3381000175105,The Ounce Scale,The Ounce Scale (assessment scale)
3371000175107,Kent Inventory of Developmental Skills,Kent Inventory of Developmental Skills (assessment scale)
3361000175104,PEDS-DM (Parent's Evaluation of Developmental Status - Developmental Milestones),Parent's Evaluation of Developmental Status - Developmental Milestones (assessment scale)
3351000175101,Parent's Evaluation of Developmental Status,Parent's Evaluation of Developmental Status (assessment scale)
3341000175103,Infant Development Inventory,Infant Development Inventory (assessment scale)
3331000175109,Child Development Inventory,Child Development Inventory (assessment scale)
3321000175106,Brigance Screens-II,Brigance Screens-II (assessment scale)
3311000175102,Battelle Developmental Inventory Screening Tool,Battelle Developmental Inventory Screening Tool (assessment scale)
3191000175106,Child-Pugh score,Child-Pugh score (assessment scale)
1296651007,Bath Ankylosing Spondylitis Functional Index,Bath Ankylosing Spondylitis Functional Index (assessment scale)
1296649008,Bath Ankylosing Spondylitis Metrology Index,Bath Ankylosing Spondylitis Metrology Index (assessment scale)
1295479002,International Classification of Diseases 10th Revision glaucoma staging system,International Classification of Diseases 10th Revision glaucoma staging system (staging scale)
1290543005,Pediatric Canadian Triage and Acuity Scale,Pediatric Canadian Triage and Acuity Scale (assessment scale)
1290510006,Modified Tardieu Scale,Modified Tardieu Scale (assessment scale)
1290318003,Hodapp Parrish Anderson glaucoma staging system,Hodapp Parrish Anderson glaucoma staging system (staging scale)
1290301002,International Federation of Gynecology and Obstetrics grading system for carcinoma of uterine corpus,International Federation of Gynecology and Obstetrics grading system for carcinoma of uterine corpus (staging scale)
1290285005,Risk Score for Transport Patients,Risk Score for Transport Patients (assessment scale)
1290008003,Gijon's social-familial evaluation scale,Gijon's social-familial evaluation scale (assessment scale)
1290005000,Duke Activity Scale Index,Duke Activity Scale Index (assessment scale)
1290002002,Alberta Stroke Program Early CT score,Alberta Stroke Program Early CT score (assessment scale)
1289999007,Gugging Swallowing Screen,Gugging Swallowing Screen (assessment scale)
1287958009,French-American-British classification system,French-American-British classification system (tumor staging)
1287845009,Children's Oncology Group liver staging system,Children's Oncology Group liver staging system (tumor staging)
1287844008,Children's Oncology Group renal staging system,Children's Oncology Group renal staging system (tumor staging)
1287839001,Premature Infant Pain Profile - Revised,Premature Infant Pain Profile - Revised (assessment scale)
1287838009,Premature Infant Pain Profile,Premature Infant Pain Profile (assessment scale)
1287726005,DOLOPLUS-2 scale,DOLOPLUS-2 scale (assessment scale)
1287648008,Masaoka-Koga stage classification for thymic malignancies,Masaoka-Koga stage classification for thymic malignancies (tumor staging)
1287647003,Toronto Childhood Cancer Stage Guidelines Version 2,Toronto Childhood Cancer Stage Guidelines Version 2 (tumor staging)
1287646007,International Germ Cell Consensus Classification,International Germ Cell Consensus Classification (tumor staging)
1287643004,INRG (International Neuroblastoma Risk Group) staging system,International Neuroblastoma Risk Group staging system (tumor staging)
1287387001,Killip classification,Killip classification (assessment scale)
1287377000,"Mechanism, Glasgow Coma Scale, Age, Pressure score","Mechanism, Glasgow Coma Scale, Age, Pressure score (assessment scale)"
1287376009,Minnesota Living with Heart Failure Questionnaire,Minnesota Living with Heart Failure Questionnaire (assessment scale)
1287375008,Nutritional Risk Screening 2002,Nutritional Risk Screening 2002 (assessment scale)
1287374007,Portuguese Registry of Acute Coronary Syndromes risk score,Portuguese Registry of Acute Coronary Syndromes risk score (assessment scale)
1287359005,Rapid Arterial Occlusion Evaluation Scale,Rapid Arterial Occlusion Evaluation Scale (assessment scale)
1287358002,National Early Warning Score,National Early Warning Score (assessment scale)
1287357007,"Strength, Assistance walking, Rising from chair, Climbing stairs and Falls questionnaire","Strength, Assistance walking, Rising from chair, Climbing stairs and Falls questionnaire (assessment scale)"
1287356003,Cincinnati Prehospital Stroke Scale,Cincinnati Prehospital Stroke Scale (assessment scale)
1287355004,Neonatal Skin Risk Assessment Scale,Neonatal Skin Risk Assessment Scale (assessment scale)
1287354000,Screening Tool for Risk on Nutritional Status and Growth,Screening Tool for Risk on Nutritional Status and Growth (assessment scale)
1287352001,Neelon and Champagne Confusion Scale,Neelon and Champagne Confusion Scale (assessment scale)
1287348001,Finnegan Neonatal Abstinence Scoring Tool,Finnegan Neonatal Abstinence Scoring Tool (assessment scale)
1287347006,Graffar index,Graffar index (assessment scale)
1287346002,Control of Allergic Rhinitis and Asthma Test,Control of Allergic Rhinitis and Asthma Test (assessment scale)
1287344004,Apgar score,Apgar score (assessment scale)
1284937005,World Health Organization grading system for urothelial carcinoma,World Health Organization grading system for urothelial carcinoma (staging scale)
1284924007,"Revised Face, Legs, Activity, Cry, Consolability scale","Revised Face, Legs, Activity, Cry, Consolability scale (assessment scale)"
1284908006,Faces Pain Scale – Revised,Faces Pain Scale – Revised (assessment scale)
1284903002,Neonatal Pain Assessment and Sedation Scale,Neonatal Pain Assessment and Sedation Scale (assessment scale)
1284900004,Neonatal Infant Pain Scale,Neonatal Infant Pain Scale (assessment scale)
1284895003,EDIN - Échelle de Douleur et d'Inconfort du Nouveau-né,Échelle de Douleur et d'Inconfort du Nouveau-né (assessment scale)
1284852002,Numeric Pain Rating Scale,Numeric Pain Rating Scale (assessment scale)
1269566009,"American Joint Commission on Cancer, Cancer Staging Manual, 9th version neoplasm staging system","American Joint Commission on Cancer, Cancer Staging Manual, 9th version neoplasm staging system (tumor staging)"
1268555009,World Health Organization classification of adenocarcinoma in stomach fifth edition,World Health Organization classification of adenocarcinoma in stomach fifth edition (staging scale)
1268554008,Lauren classification of adenocarcinoma in stomach,Lauren classification of adenocarcinoma in stomach (staging scale)
1260098002,World Health Organization and International Society of Urological Pathology grading system for renal cell carcinoma,World Health Organization and International Society of Urological Pathology grading system for renal cell carcinoma (staging scale)
1259216002,Pressure Ulcer Scale for Healing,Pressure Ulcer Scale for Healing (assessment scale)
1259215003,Maelor Scale,Maelor Scale (assessment scale)
1237453009,IDDSI (International Dysphagia Diet Standardisation Initiative) Framework,International Dysphagia Diet Standardisation Initiative Framework (assessment scale)
1231516005,Social Anxiety Scale for Children-Revised,Social Anxiety Scale for Children-Revised (assessment scale)
1231515009,Social Avoidance and Distress Scale,Social Avoidance and Distress Scale (assessment scale)
1231514008,Neuropsychiatric Inventory Questionnaire,Neuropsychiatric Inventory Questionnaire (assessment scale)
1231513002,Conners Comprehensive Behavior Rating Scales,Conners Comprehensive Behavior Rating Scales (assessment scale)
1231512007,Liebowitz Social Anxiety Scale,Liebowitz Social Anxiety Scale (assessment scale)
1231511000,Personality Diagnostic Questionnaire Version 4,Personality Diagnostic Questionnaire Version 4 (assessment scale)
1231505003,IDDSI-FDS - International Dysphagia Diet Standardisation Initiative Functional Diet Scale,International Dysphagia Diet Standardisation Initiative Functional Diet Scale (assessment scale)
1231458005,Ways of Coping Questionnaire,Ways of Coping Questionnaire (assessment scale)
1231454007,Hamilton Anxiety Rating Scale,Hamilton Anxiety Rating Scale (assessment scale)
1231453001,Adolescent Life Change Event Scale,Adolescent Life Change Event Scale (assessment scale)
1231452006,Standardised Assessment of Personality – Abbreviated Scale,Standardised Assessment of Personality – Abbreviated Scale (assessment scale)
1231444008,Child Behavior Checklist,Child Behavior Checklist (assessment scale)
1231443002,Bush-Francis Catatonia Rating Scale,Bush-Francis Catatonia Rating Scale (assessment scale)
1231442007,Children's Loneliness Scale,Children's Loneliness Scale (assessment scale)
1231441000,Internet Addiction Test,Internet Addiction Test (assessment scale)
1231440004,Piers-Harris Children's Self-Concept Scale,Piers-Harris Children's Self-Concept Scale (assessment scale)
1231439001,Calgary Depression Scale for Schizophrenia,Calgary Depression Scale for Schizophrenia (assessment scale)
1231438009,Medication Adherence Rating Scale,Medication Adherence Rating Scale (assessment scale)
1179529001,Edwards Personal Preference Schedule,Edwards Personal Preference Schedule (assessment scale)
1155953005,Pulmonary Embolism Rule-out Criteria,Pulmonary Embolism Rule-out Criteria (assessment scale)
1155951007,Revised Geneva score for pulmonary embolism,Revised Geneva score for pulmonary embolism (assessment scale)
1149430001,World Health Organization classification of tumors histologic grading system fifth edition,World Health Organization classification of tumors histologic grading system fifth edition (staging scale)
1149429006,World Health Organization classification of tumors histologic grading system,World Health Organization classification of tumors histologic grading system (staging scale)
1149300008,Subjective Global Nutritional Assessment for children,Subjective Global Nutritional Assessment for children (assessment scale)
1149295006,Malignant tumor staging,Malignant tumor staging (tumor staging)
1149164009,Australian Clinico-pathological Staging System for colorectal cancer,Australian Clinicopathological Staging System for colorectal cancer (tumor staging)
1149163003,Revised International Staging System for multiple myeloma,Revised International Staging System for multiple myeloma (staging scale)
1149162008,International Staging System for multiple myeloma,International Staging System for multiple myeloma (staging scale)
1149131009,Rai staging system for chronic lymphocytic leukemia,Rai staging system for chronic lymphocytic leukemia (tumor staging)
1149100002,Chronic Lymphocytic Leukemia International Prognostic Index,Chronic Lymphocytic Leukemia International Prognostic Index (assessment scale)
1149099005,Binet staging classification for chronic lymphocytic leukemia,Binet staging classification for chronic lymphocytic leukemia (tumor staging)
1148703001,Psychotic Depression Assessment Scale,Psychotic Depression Assessment Scale (assessment scale)
1148425008,Montreal Cognitive Assessment version 7.1,Montreal Cognitive Assessment version 7.1 (assessment scale)
1148424007,Montreal Cognitive Assessment version 7.2,Montreal Cognitive Assessment version 7.2 (assessment scale)
1148423001,Montreal Cognitive Assessment version 8.1,Montreal Cognitive Assessment version 8.1 (assessment scale)
1148422006,Montreal Cognitive Assessment version 7.3,Montreal Cognitive Assessment version 7.3 (assessment scale)
1145071008,Padua Prediction Score for risk of venous thromboembolism,Padua Prediction Score for risk of venous thromboembolism (assessment scale)
1144796009,Verbal Rating Scale for pain intensity,Verbal Rating Scale for pain intensity (assessment scale)
1144752009,5-item World Health Organization Well-being Index questionnaire,5-item World Health Organization Well-being Index questionnaire (assessment scale)
1144751002,EuroQol five dimension three level questionnaire,EuroQol five dimension three level questionnaire (assessment scale)
1144349004,Framingham cardiovascular disease 30 year risk score,Framingham cardiovascular disease 30 year risk score (assessment scale)
1137327001,Saint Louis University Mental Status,Saint Louis University Mental Status examination (assessment scale)
1003686001,Postpartum Depression Screening Scale,Postpartum Depression Screening Scale (assessment scale)
1003471000,Orthostatic Hypotension Questionnaire,Orthostatic Hypotension Questionnaire (assessment scale)
897482009,Spence Children's Anxiety Scale - Child Version,Spence Children's Anxiety Scale - Child Version (assessment scale)
897481002,Spence Children's Anxiety Scale - Parent Version,Spence Children's Anxiety Scale - Parent Version (assessment scale)
897479004,Spence Children's Anxiety Scale,Spence Children's Anxiety Scale (assessment scale)
897275008,"American Joint Commission on Cancer, Cancer Staging Manual, 8th edition neoplasm staging system","American Joint Commission on Cancer, Cancer Staging Manual, 8th edition neoplasm staging system (tumor staging)"
897202005,Gleason scoring system for malignant neoplasm of prostate,Gleason scoring system for malignant neoplasm of prostate (staging scale)
897117004,"Frequency, Intensity, and Burden of Side Effects Ratings scale","Frequency, Intensity, and Burden of Side Effects Ratings scale (assessment scale)"
897114006,Simple Endoscopic Score for Crohn's Disease,Simple Endoscopic Score for Crohn's Disease (assessment scale)
895537006,MNA - Mini Nutritional Assessment,Mini Nutritional Assessment (assessment scale)
895536002,PG-SGA - Patient-Generated Subjective Global Assessment,Scored Patient-Generated Subjective Global Assessment (assessment scale)
870188006,American Neurogastroenterology and Motility Society Gastroparesis Cardinal Symptom Index-Daily Diary,American Neurogastroenterology and Motility Society Gastroparesis Cardinal Symptom Index-Daily Diary (assessment scale)
870186005,"Behavior Assessment System for Children, Second Edition","Behavior Assessment System for Children, Second Edition (assessment scale)"
870183002,Gastroesophageal Reflux Disease-Health Related Quality of Life questionnaire,Gastroesophageal Reflux Disease-Health Related Quality of Life questionnaire (assessment scale)
870181000,Brief Esophageal Dysphagia Questionnaire,Brief Esophageal Dysphagia Questionnaire (assessment scale)
870179002,modified Medical Research Council Dyspnea Scale,modified Medical Research Council Dyspnea Scale (assessment scale)
868183002,Functional Assessment of Cancer Therapy - Brain,Functional Assessment of Cancer Therapy - Brain (assessment scale)
866023006,Opioid Risk Tool,Opioid Risk Tool (assessment scale)
865999006,Clinical Global Impression,Clinical Global Impression (assessment scale)
865998003,Columbia Suicide Severity Rating Scale,Columbia Suicide Severity Rating Scale (assessment scale)
865991009,CogState Brief Battery,CogState Brief Battery (assessment scale)
865968005,Mini International Neuropsychiatric Interview for Children and Adolescents,Mini International Neuropsychiatric Interview for Children and Adolescents (assessment scale)
865965008,Psychiatric Research Interview for Substance and Mental Disorders,Psychiatric Research Interview for Substance and Mental Disorders (assessment scale)
865963001,modified Severity Weighted Assessment Tool,modified Severity Weighted Assessment Tool (assessment scale)
865935003,Patient Health Questionnaire-4,Patient Health Questionnaire-4 (assessment scale)
865932000,Mood Disorder Questionnaire,Mood Disorder Questionnaire (assessment scale)
865931007,Scale for Assessment and Rating of Ataxia,Scale for Assessment and Rating of Ataxia (assessment scale)
865927001,Emotional Stress Reaction Questionnaire,Emotional Stress Reaction Questionnaire (assessment scale)
865926005,Headache Impact Test-6,Headache Impact Test-6 (assessment scale)
865924008,Cutaneous Dermatomyositis Disease Area and Severity Index,Cutaneous Dermatomyositis Disease Area and Severity Index (assessment scale)
865921000,Autism Spectrum Screening Questionnaire,Autism Spectrum Screening Questionnaire (assessment scale)
865919005,Sleep Inertia Questionnaire,Sleep Inertia Questionnaire (assessment scale)
865915004,Bakas Caregiving Outcomes Scales,Bakas Caregiving Outcomes Scales (assessment scale)
865914000,Preparedness for Caregiving Scale,Preparedness for Caregiving Scale (assessment scale)
840555004,Birmingham Vasculitis Activity Score,Birmingham Vasculitis Activity Score (assessment scale)
840418002,Yale-Brown Obsessive Compulsive Scale,Yale-Brown Obsessive Compulsive Scale (assessment scale)
840366005,Pelvic Organ Prolapse/Urinary Incontinence Sexual Questionnaire 12,Pelvic Organ Prolapse/Urinary Incontinence Sexual Questionnaire 12 (assessment scale)
840352000,Modified Rankin Scale,Modified Rankin Scale (assessment scale)
838443007,Tegner Activity Scale,Tegner Activity Scale (assessment scale)
838442002,Altman Self-Rating Mania Scale,Altman Self-Rating Mania Scale (assessment scale)
836483005,Patient Experience with Treatment and Self-management questionnaire,Patient Experience with Treatment and Self-management questionnaire (assessment scale)
819958009,Healthy Eating Index 2015,Healthy Eating Index 2015 (assessment scale)
789278003,Clavien-Dindo complication scale,Clavien-Dindo complication scale (assessment scale)
789163003,Borg Rating of Perceived Exertion,Borg Rating of Perceived Exertion (assessment scale)
789162008,Modified Borg dyspnoea scale,Borg category ratio 10 scale (assessment scale)
787454004,Post Anesthetic Recovery score,Post Anesthetic Recovery score (assessment scale)
782845000,Knee Injury and Osteoarthritis Outcome Score,Knee Injury and Osteoarthritis Outcome Score (assessment scale)
781128005,Braden Scale,Braden Scale (assessment scale)
774093002,Global Deterioration Scale,Global Deterioration Scale (assessment scale)
772814007,NAFLD (Non-Alcoholic Fatty Liver Disease) fibrosis score,Non-Alcoholic Fatty Liver Disease fibrosis score system (assessment scale)
771274008,Ferriman-Gallwey scale,Ferriman-Gallwey scale (assessment scale)
771162001,Modified Balance Error Scoring System,Modified Balance Error Scoring System (assessment scale)
770753000,General Practitioner Assessment of Cognition,General Practitioner Assessment of Cognition (assessment scale)
770656003,Standardized Assessment of Concussion,Standardized Assessment of Concussion (assessment scale)
770633007,EQ-5D-Y (EuroQol Five Dimension (Youth)) instrument,EuroQol Five Dimension (Youth) instrument (assessment scale)
770551000,GAS-Light - Goal Attainment Scaling-Light,Goal Attainment Scaling-Light (assessment scale)
770540000,Trauma Screening Questionnaire,Trauma Screening Questionnaire (assessment scale)
769390009,World Health Organization Adult Attention-Deficit Hyperactivity Disorder Self-Report Scale,World Health Organization Adult Attention-Deficit Hyperactivity Disorder Self-Report Scale (assessment scale)
767131006,Dysphagia Outcome and Severity Scale,Dysphagia Outcome and Severity Scale (assessment scale)
766039003,Cognitive Performance Test,Cognitive Performance Test (assessment scale)
765771006,Modified Ashworth Scale,Modified Ashworth Scale (assessment scale)
764529000,Salford Rheumatoid Arthritis Foot Evaluation Instrument,Salford Rheumatoid Arthritis Foot Evaluation Instrument (assessment scale)
763306003,Abbey Pain Scale,Abbey Pain Scale (assessment scale)
763300009,MOxFQ (Manchester-Oxford Foot Questionnaire) (foot and ankle),Manchester-Oxford Foot Questionnaire (foot and ankle) (assessment scale)
763298009,MOxFQ (Manchester-Oxford Foot Questionnaire) (foot),Manchester-Oxford Foot Questionnaire (foot) (assessment scale)
763293000,"Size (area, depth), Sepsis, Arteriopathy, Denervation system","Size (area, depth), Sepsis, Arteriopathy, Denervation system (assessment scale)"
763245006,QRISK2 cardiovascular disease 10 year risk calculator,QRISK2 cardiovascular disease 10 year risk calculator (assessment scale)
763241002,Manchester Scale for grading hallux valgus,Manchester Scale for grading hallux valgus (assessment scale)
763240001,Anticholinergic Cognitive Burden Scale,Anticholinergic Cognitive Burden Scale (assessment scale)
763238006,"PEDIS (Perfusion, Extent, Depth, Infection and Sensation) scoring system","Perfusion, Extent, Depth, Infection and Sensation scoring system (assessment scale)"
763236005,MIPI - Mantle Cell Lymphoma International Prognostic Index,Mantle Cell Lymphoma International Prognostic Index (assessment scale)
763235009,"DEPA (Depth, Extent, Phase and Associated etiology) Score","Depth, Extent, Phase and Associated etiology Score (assessment scale)"
763234008,Patient Global Impression of Improvement,Patient Global Impression of Improvement (assessment scale)
763121003,Leeds Foot Impact Scale,Leeds Foot Impact Scale (assessment scale)
763114003,Foot Function Index,Foot Function Index (assessment scale)
763113009,Footwear Suitability Scale,Footwear Suitability Scale (assessment scale)
763080002,Bristol Foot Score,Bristol Foot Score (assessment scale)
763003003,University of Texas Wound Classification System,University of Texas Wound Classification System (assessment scale)
762713009,Charlson Comorbidity Index,Charlson Comorbidity Index (assessment scale)
762241007,Dundee Coronary Risk Disk,Dundee Coronary Risk Disk (assessment scale)
761865002,POS-S Renal (Palliative care Outcome Scale symptom list for end-stage renal disease),Palliative care Outcome Scale symptom list for end-stage renal disease (assessment scale)
739664009,Diabetes Treatment Satisfaction Questionnaire change version,Diabetes Treatment Satisfaction Questionnaire change version (assessment scale)
739663003,Diabetes Treatment Satisfaction Questionnaire status version,Diabetes Treatment Satisfaction Questionnaire status version (assessment scale)
736953005,FRAX (fracture risk assessment tool) hip fracture probability assessment tool,Hip fracture probability assessment tool (assessment scale)
736952000,FRAX (fracture risk assessment tool) osteoporotic fracture probability assessment tool,Osteoporotic fracture probability assessment tool (assessment scale)
736709006,PASS - Postural Assessment Scale for Stroke Patients,Postural Assessment Scale for Stroke Patients (assessment scale)
736707008,CPAx - Chelsea Critical Care Physical Assessment tool,Chelsea Critical Care Physical Assessment tool (assessment scale)
736639007,International Consultation on Incontinence Questionnaire-Urinary Incontinence-Short Form,International Consultation on Incontinence Questionnaire-Urinary Incontinence-Short Form (assessment scale)
736043007,CRAFFT Screening Test version 2.0,"Car, Relax, Alone, Forget, Friends, Trouble Screening Test version 2.0 (assessment scale)"
736042002,CRAFFT Screening Test,"Car, Relax, Alone, Forget, Friends, Trouble Screening Test (assessment scale)"
735258002,"CHA2DS2-VASc (congestive heart failure, hypertension, age 2, diabetes mellitus, stroke 2, vascular disease, age, sex category) score","Congestive heart failure, hypertension, age 2, diabetes mellitus, stroke 2, vascular disease, age, sex category score (assessment scale)"
725887003,Movement Assessment Battery for Children Checklist Second Edition,Movement Assessment Battery for Children Checklist Second Edition (assessment scale)
