code,display,definition
273935006,World Health Organization (WHO) orientation handicap scale,World Health Organization orientation handicap scale (assessment scale)
273934005,World Health Organization (WHO) occupation handicap scale,World Health Organization occupation handicap scale (assessment scale)
273933004,World Health Organization (WHO) mobility handicap scale,World Health Organization mobility handicap scale (assessment scale)
273932009,World Health Organization (WHO) economic self-sufficiency handicap scale,World Health Organization economic self-sufficiency handicap scale (assessment scale)
273931002,"World Health Organization (WHO) classification of impairments, disabilities and handicap scale","World Health Organization classification of impairments, disabilities and handicap scale (assessment scale)"
273930001,World Health Organization (WHO) handicap scale,World Health Organization handicap scale (assessment scale)
273929006,WHO depression scale,World Health Organization depression scale (assessment scale)
273928003,Westmead Post-Traumatic Amnesia Scale,Westmead Post-Traumatic Amnesia Scale (assessment scale)
273927008,Western aphasia battery,Western aphasia battery (assessment scale)
273926004,Wessex revised portage language checklist,Wessex revised portage language checklist (assessment scale)
273925000,Wepman test of auditory processing disorders,Wepman test of auditory processing disorders (assessment scale)
273924001,Wepman digit span test,Wepman digit span test (assessment scale)
273923007,Weigl - Goldstein - Scheerer color form sorting test,Weigl - Goldstein - Scheerer color form sorting test (assessment scale)
273922002,Wechsler pre-school and primary scale of intelligence,Wechsler pre-school and primary scale of intelligence (assessment scale)
273921009,Wechsler memory scale,Wechsler memory scale (assessment scale)
273920005,Wechsler intelligence verbal assessment,Wechsler intelligence verbal assessment (assessment scale)
273919004,Wechsler intelligence non-verbal performance assessment,Wechsler intelligence non-verbal performance assessment (assessment scale)
273918007,Wechsler intelligence scale for children,Wechsler intelligence scale for children (assessment scale)
273917002,Wechsler adult intelligence scale - revised,Wechsler adult intelligence scale - revised (assessment scale)
273916006,Wechsler adult intelligence scale,Wechsler adult intelligence scale (assessment scale)
273915005,Warner dysphagia assessment,Warner dysphagia assessment (assessment scale)
273914009,Ward behaviour rating scale,Ward behavior rating scale (assessment scale)
273913003,Wakefield self-assessment depression inventory,Wakefield self-assessment depression inventory (assessment scale)
273912008,Waddell disability index,Waddell disability index (assessment scale)
273910000,Voice skills assessment,Voice skills assessment (assessment scale)
273909005,Voice evaluation form,Voice evaluation form (assessment scale)
273908002,Voice assessment sheet - Martin,Voice assessment sheet - Martin (assessment scale)
273906003,Visual object and spatial perception test,Visual object and spatial perception test (assessment scale)
273905004,Visual and perceptual assessment programme,Visual and perceptual assessment program (assessment scale)
273904000,Visual analog pain scale,Visual analog pain scale (assessment scale)
273903006,Visual analogue scale,Visual analog scale (assessment scale)
273902001,Visick symptom grade,Visick symptom grade (assessment scale)
273901008,Vineland behavioural assessment,Vineland behavioral assessment (assessment scale)
273900009,Vineland subquotient - socialisation,Vineland subquotient - socialization (assessment scale)
273899004,Vineland subquotient - self-help in eating,Vineland subquotient - self-help in eating (assessment scale)
273898007,Vineland subquotient - occupation,Vineland subquotient - occupation (assessment scale)
273897002,Vineland subquotient - locomotion,Vineland subquotient - locomotion (assessment scale)
273896006,Vineland subquotient - communication,Vineland subquotient - communication (assessment scale)
273895005,Vineland subquotient - general self-help,Vineland subquotient - general self-help (assessment scale)
273894009,Vineland social maturity scale,Vineland social maturity scale (assessment scale)
273893003,Vineland maturity scales adapted for the blind,Vineland maturity scales adapted for the blind (assessment scale)
273892008,Vernon graded word reading test,Vernon graded word reading test (assessment scale)
273891001,Vernon Cloze procedure reading test,Vernon Cloze procedure reading test (assessment scale)
273889009,Valpar 17 pre-vocational readiness battery,Valpar 17 pre-vocational readiness battery (assessment scale)
273888001,Valentine auditory memory test,Valentine auditory memory test (assessment scale)
273887006,Triage index,Triage index (assessment scale)
273886002,Trauma and injury severity score,Trauma and injury severity score (assessment scale)
273885003,Revised trauma score,Revised trauma score (assessment scale)
273884004,Trauma score,Trauma score (assessment scale)
273883005,Trauma index,Trauma index (assessment scale)
273882000,Trail making test,Trail making test (assessment scale)
273881007,Token test,Token test (assessment scale)
273880008,Time trade off analysis,Time trade off analysis (assessment scale)
273879005,Time line follow back,Time line follow back (assessment scale)
273878002,Therapeutic intervention scoring system,Therapeutic intervention scoring system (assessment scale)
273877007,Test of word knowledge,Test of word knowledge (assessment scale)
273876003,Test of word finding in discourse,Test of word finding in discourse (assessment scale)
273875004,Test of syntactic abilities,Test of syntactic abilities (assessment scale)
273874000,Test of reception of grammar,Test of reception of grammar (assessment scale)
273873006,Test of pragmatic skills,Test of pragmatic skills (assessment scale)
273872001,Test of motor impairment - Stott-Moyes-Henderson,Test of motor impairment - Stott-Moyes-Henderson (assessment scale)
273871008,Test of language development 2,Test of language development 2 (assessment scale)
273870009,Test of language competence,Test of language competence (assessment scale)
273869008,Test of auditory discrimination,Test of auditory discrimination (assessment scale)
273868000,Test of auditory comprehension of language,Test of auditory comprehension of language (assessment scale)
273867005,Test for auditory perception of speech,Test for auditory perception of speech (assessment scale)
273865002,Tender joint count,Tender joint count (assessment scale)
273864003,Tamb test,Tamb test (assessment scale)
273863009,Systemic lupus erythematosus disease activity index,Systemic lupus erythematosus disease activity index (assessment scale)
273862004,Systemic lupus activity measure,Systemic lupus activity measure (assessment scale)
273861006,Systematic fluency training for young children,Systematic fluency training for young children (assessment scale)
273860007,Synonym learning test,Synonym learning test (assessment scale)
273859002,Symptom checklist,Symptom checklist (assessment scale)
273858005,Symbolic play test,Symbolic play test (assessment scale)
273857000,Symbol digit modalities test,Symbol digit modalities test (assessment scale)
273856009,Swollen joint count,Swollen joint count (assessment scale)
273854007,Supplementary language test,Supplementary language test (assessment scale)
273853001,Sunnybrook cord injury scale,Sunnybrook cord injury scale (assessment scale)
273852006,Suicide risk scale,Suicide risk scale (assessment scale)
273850003,Substance use disorder diagnostic schedule,Substance use disorder diagnostic schedule (assessment scale)
273849003,Subjective global assessment,Subjective global assessment (assessment scale)
273848006,Stycar hearing test,Stycar hearing test (assessment scale)
273847001,Stuttering severity instrument,Stuttering severity instrument (assessment scale)
273846005,Stuttering prediction instrument,Stuttering prediction instrument (assessment scale)
273845009,Stuttering intervention program,Stuttering intervention program (assessment scale)
273844008,Structured interview for DSM-III personality disorders,"Structured interview for Diagnostic and Statistical Manual of Mental Disorders, Third Edition, personality disorders (assessment scale)"
273843002,Structured clinical interview for DSM-III-R,Structured clinical interview for Diagnostic and Statistical Manual of Mental Disorders-Third Edition Revised (assessment scale)
273842007,Structured observation test of function,Structured observation test of function (assessment scale)
273841000,Story completion test,Story completion test (assessment scale)
273840004,Stockton geriatric rating scale,Stockton geriatric rating scale (assessment scale)
273839001,Stocker probe technique for diagnosis and treatment of stuttering in young children,Stocker probe technique for diagnosis and treatment of stuttering in young children (assessment scale)
273838009,Stimulus response inventory,Stimulus response inventory (assessment scale)
273837004,Steinbrocker functional classification,Steinbrocker functional classification (assessment scale)
273836008,Stanford Binet intelligence scale,Stanford Binet intelligence scale (assessment scale)
273835007,Standardized assessment of personality,Standardized assessment of personality (assessment scale)
273834006,St Thomas's disability questionnaire,St Thomas's disability questionnaire (assessment scale)
273833000,St George's hospital respiratory questionnaire,St George's hospital respiratory questionnaire (assessment scale)
273831003,Spitzer quality of life index,Spitzer quality of life index (assessment scale)
273830002,Spielberger state-trait anxiety inventory,Spielberger state-trait anxiety inventory (assessment scale)
273829007,Speech intelligibility assessment procedure,Speech intelligibility assessment procedure (assessment scale)
273828004,Special hospitals assessment of personality,Special hospitals assessment of personality (assessment scale)
273827009,Spare time activities questionnaire,Spare time activities questionnaire (assessment scale)
273826000,Southern California sensory integration test,Southern California sensory integration test (assessment scale)
273825001,Southern California postrotary nystagmus test,Southern California postrotary nystagmus test (assessment scale)
273824002,Southern California figure ground visual perception test,Southern California figure ground visual perception test (assessment scale)
273823008,South Tyneside assessment of syntactic structures,South Tyneside assessment of syntactic structures (assessment scale)
273822003,South Tyneside assessment of phonology,South Tyneside assessment of phonology (assessment scale)
273820006,Social support questionnaire,Social support questionnaire (assessment scale)
273819000,Social behavior assessment scale,Social behavior assessment scale (assessment scale)
273818008,Social adjustment scale self - report,Social adjustment scale self - report (assessment scale)
273817003,Social adjustment scale II,Social adjustment scale II (assessment scale)
273816007,Social adjustment scale,Social adjustment scale (assessment scale)
273815006,Smith cognitive questionnaire,Smith cognitive questionnaire (assessment scale)
273814005,Situations for eating scale,Situations for eating scale (assessment scale)
273813004,Situational confidence questionnaire,Situational confidence questionnaire (assessment scale)
273812009,Simplified acute physiology scale II,Simplified acute physiology scale II (assessment scale)
273811002,Simplified Acute Physiology Score,Simplified Acute Physiology Score (assessment scale)
273809006,Silvers cerebral function test,Silvers cerebral function test (assessment scale)
273807008,Sickness impact profile,Sickness impact profile (assessment scale)
273806004,Shulman test of pragmatic skills,Shulman test of pragmatic skills (assessment scale)
273805000,Short-term memory test,Short-term memory test (assessment scale)
273804001,Short orientation-memory-concentration test - alternative version,Short orientation-memory-concentration test - alternative version (assessment scale)
273803007,Short Orientation - Memory - Concentration Test,Short Orientation - Memory - Concentration Test (assessment scale)
273802002,Short alcohol dependence data,Short alcohol dependence data (assessment scale)
273801009,Shaper index,Shaper index (assessment scale)
273800005,Severity of opiate dependence questionnaire,Severity of opiate dependence questionnaire (assessment scale)
273799006,Severity of alcohol dependence questionnaire,Severity of alcohol dependence questionnaire (assessment scale)
273798003,Serial sevens test,Serial sevens test (assessment scale)
273797008,Sentence comprehension test,Sentence comprehension test (assessment scale)
273795000,Sensory Integration and Praxis Test,Sensory Integration and Praxis Test (assessment scale)
273793007,Screening test for auditory processing disorders,Screening test for auditory processing disorders (assessment scale)
273792002,Screening for developmental apraxia of speech,Screening for developmental apraxia of speech (assessment scale)
273791009,Scissor skills checklist,Scissor skills checklist (assessment scale)
273788009,Schofield equation,Schofield equation (assessment scale)
273787004,Schnijders Ooman test for deaf children,Schnijders Ooman test for deaf children (assessment scale)
273786008,Schedules for clinical assessment in neuropsychiatry,Schedules for clinical assessment in neuropsychiatry (assessment scale)
273785007,Schwachmann score,Schwachmann score (assessment scale)
273784006,Scale of early communication skills for hearing impaired children,Scale of early communication skills for hearing impaired children (assessment scale)
273783000,Savary Miller scale,Savary Miller scale (assessment scale)
273782005,Santa Clara valley medical center functional assessment measure,Santa Clara valley medical center functional assessment measure (assessment scale)
273781003,Sandwell bilingual comprehension test,Sandwell bilingual comprehension test (assessment scale)
273780002,Samaritan orientation test,Samaritan orientation test (assessment scale)
273779000,Salford reading test,Salford reading test (assessment scale)
273778008,S scale Andrews and Cutler,S scale Andrews and Cutler (assessment scale)
273777003,Rutter B2 scale,Rutter B2 scale (assessment scale)
273776007,Rutter B scale,Rutter B scale (assessment scale)
273775006,Rutter A scale,Rutter A scale (assessment scale)
273774005,Rutter Behaviour Questionnaire,Rutter Behaviour Questionnaire (assessment scale)
273772009,Routine task inventory,Routine task inventory (assessment scale)
273771002,Rotterdam symptom check list,Rotterdam symptom check list (assessment scale)
273770001,Roth and Spekman list of communicative intentions,Roth and Spekman list of communicative intentions (assessment scale)
273769002,Rosser's classification of illness states,Rosser's classification of illness states (assessment scale)
273768005,Ross information processing assessment,Ross information processing assessment (assessment scale)
273767000,Rose Summers pragmatic profile,Rose Summers pragmatic profile (assessment scale)
273766009,Roehampton ADL for amputees,Roehampton activities of daily living for amputees (assessment scale)
273765008,Robertson dysarthria profile,Robertson dysarthria profile (assessment scale)
273764007,Robertson dysarthria assessment,Robertson dysarthria assessment (assessment scale)
273763001,Rivermead perceptual assessment battery,Rivermead perceptual assessment battery (assessment scale)
273762006,Rivermead motor assessment,Rivermead motor assessment (assessment scale)
273761004,Rivermead behavioural memory test,Rivermead behavioral memory test (assessment scale)
273758000,Ritchie articular index,Ritchie articular index (assessment scale)
273757005,Right hemisphere battery,Right hemisphere battery (assessment scale)
273756001,Reynell Zinkin language scale for the visually impaired,Reynell Zinkin language scale for the visually impaired (assessment scale)
273754003,Reynell expressive language assessment,Reynell expressive language assessment (assessment scale)
273753009,Reynell verbal comprehension scale B assessment,Reynell verbal comprehension scale B assessment (assessment scale)
273752004,Reynell developmental language scales,Reynell developmental language scales (assessment scale)
273751006,Revised Iowa scale for rating severity,Revised Iowa scale for rating severity (assessment scale)
273750007,Restrained eating inventory,Restrained eating inventory (assessment scale)
273749007,Respiratory index,Respiratory index (assessment scale)
273748004,Resistance to change grid,Resistance to change grid (assessment scale)
273747009,Reporters tests,Reporters tests (assessment scale)
273746000,Repertory grid,Repertory grid (assessment scale)
273745001,Renfrew wordfinding,Renfrew wordfinding (assessment scale)
273744002,Renfrew articulation test,Renfrew articulation test (assessment scale)
273743008,Renfrew action picture test,Renfrew action picture test (assessment scale)
273742003,Renal index,Renal index (assessment scale)
273741005,Relative Stress Scale,Relative Stress Scale (assessment scale)
273740006,Recognition memory test,Recognition memory test (assessment scale)
273739009,Receptive expressive emergent language scale,Receptive expressive emergent language scale (assessment scale)
273738001,Reasons for smoking scale,Reasons for smoking scale (assessment scale)
273737006,Reasons for eating scale,Reasons for eating scale (assessment scale)
273736002,Reading comprehension battery for aphasia,Reading comprehension battery for aphasia (assessment scale)
273735003,Read word discrimination test,Read word discrimination test (assessment scale)
273733005,Raven Standard Progressive Matrices,Raven Standard Progressive Matrices (assessment scale)
273732000,Raven Colored Progressive Matrices,Raven Colored Progressive Matrices (assessment scale)
273731007,Rating communicative behaviour in head injured adults,Rating communicative behavior in head injured adults (assessment scale)
273730008,Rappaport disability rating scale,Rappaport disability rating scale (assessment scale)
273729003,Rankin scale,Rankin scale (assessment scale)
273728006,Rand functional limitations battery,Rand functional limitations battery (assessment scale)
273726005,Quality of wellbeing scale,Quality of wellbeing scale (assessment scale)
273725009,Quality of life scale,Quality of life scale (assessment scale)
273724008,Quality adjusted life years,Quality adjusted life years (assessment scale)
273723002,Quadriplegia index of function,Quadriplegia index of function (assessment scale)
273722007,Pyramids and palm trees test,Pyramids and palm trees test (assessment scale)
273721000,Purdue pegboard scale,Purdue pegboard scale (assessment scale)
273720004,PULSES profile,PULSES profile (assessment scale)
273719005,Psychological adjustment to illness scale,Psychological adjustment to illness scale (assessment scale)
273718002,Psycholinguistic assessments of language processing in aphasia,Psycholinguistic assessments of language processing in aphasia (assessment scale)
273717007,Profile of mood states,Profile of mood states (assessment scale)
273716003,Profile of communicative appropriateness,Profile of communicative appropriateness (assessment scale)
273715004,Profile in semantics,Profile in semantics (assessment scale)
273714000,Problem oriented medical record,Problem oriented medical record (assessment scale)
273713006,Probability of death score,Probability of death score (assessment scale)
273712001,Previous IQ assessment by pronunciation,Previous intelligence quotient assessment by pronunciation (assessment scale)
273711008,Preschool language scale,Preschool language scale (assessment scale)
273709004,Pre-speech assessment scale,Pre-speech assessment scale (assessment scale)
273707002,Pre-school Boehm,Pre-school Boehm (assessment scale)
273706006,Preschool behaviour check list,Preschool behavior check list (assessment scale)
273705005,Pragmatics profile of early communication skills,Pragmatics profile of early communication skills (assessment scale)
273704009,Pragmatics profile,Pragmatics profile (assessment scale)
273703003,Positive and negative syndrome scale,Positive and negative syndrome scale (assessment scale)
273702008,Porch index of communicative ability,Porch index of communicative ability (assessment scale)
273701001,Picture pointing test,Picture pointing test (assessment scale)
273699001,PIP developmental charts,Parental Involvement Project developmental charts (assessment scale)
273697004,Phonological assessment of child speech,Phonological assessment of child speech (assessment scale)
273696008,Philadelphia geriatric center morale scale,Philadelphia geriatric center morale scale (assessment scale)
273695007,Personality assessment schedule,Personality assessment schedule (assessment scale)
273694006,Performance test of activities of daily living,Performance test of activities of daily living (assessment scale)
273693000,Perceptions of stuttering inventory,Perceptions of stuttering inventory (assessment scale)
273692005,Peabody picture vocabulary test,Peabody picture vocabulary test (assessment scale)
273691003,PETAL speech assessment procedure,Phonological Evaluation and Transcription of Audio-Visual Language speech assessment procedure (assessment scale)
273690002,16 Personality factor questionnaire,16 Personality factor questionnaire (assessment scale)
273689006,Patient satisfaction score,Patient satisfaction score (assessment scale)
273688003,Patient activity checklist,Patient activity checklist (assessment scale)
273687008,Partners in augmentative communication training,Partners in augmentative communication training (assessment scale)
273686004,Pantomime test,Pantomime test (assessment scale)
273685000,Pain diary,Pain diary (assessment scale)
273684001,Paediatric trauma score,Pediatric trauma score (assessment scale)
273683007,Paediatric risk of mortality,Pediatric risk of mortality (assessment scale)
273682002,Paediatric oral skills profile,Pediatric oral skills profile (assessment scale)
273681009,Paediatric clinical test of sensory integration and balance,Pediatric clinical test of sensory integration and balance (assessment scale)
273680005,Padua inventory,Padua inventory (assessment scale)
273677009,Oxford grading scale for muscle strength,Oxford grading scale for muscle strength (assessment scale)
273675001,Oswestry disability index,Oswestry disability index (assessment scale)
273674002,OPCS seeing disability scale,Office of Population Census and Surveys seeing disability scale (assessment scale)
273673008,OPCS reaching and stretching disability scale,Office of Population Census and Surveys reaching and stretching disability scale (assessment scale)
273672003,OPCS personal care disability scale,Office of Population Census and Surveys personal care disability scale (assessment scale)
273671005,OPCS locomotion disability scale,Office of Population Census and Surveys locomotion disability scale (assessment scale)
273670006,OPCS intellectual functioning disability scale,Office of Population Census and Surveys intellectual functioning disability scale (assessment scale)
273669005,OPCS hearing disability scale,Office of Population Census and Surveys hearing disability scale (assessment scale)
273668002,"OPCS eating, drinking and digestion disability scale","Office of Population Census and Surveys eating, drinking and digestion disability scale (assessment scale)"
273667007,OPCS disfigurement disability scale,Office of Population Census and Surveys disfigurement disability scale (assessment scale)
273666003,OPCS dexterity disability scale,Office of Population Census and Surveys dexterity disability scale (assessment scale)
273665004,OPCS continence disability scale,Office of Population Census and Surveys continence disability scale (assessment scale)
273664000,OPCS consciousness disability scale,Office of Population Census and Surveys consciousness disability scale (assessment scale)
273663006,OPCS communication disability scale,Office of Population Census and Surveys communication disability scale (assessment scale)
273662001,OPCS behaviour disability scale,Office of Population Census and Surveys behaviour disability scale (assessment scale)
273661008,OPCS disability scales,Office of Population Census and Surveys disability scales (assessment scale)
273660009,Odstock hand assessment,Odstock hand assessment (assessment scale)
273659004,Occupational performance history interview,Occupational performance history interview (assessment scale)
273658007,Occupational case analysis interview and rating scale,Occupational case analysis interview and rating scale (assessment scale)
273657002,Occasions for smoking scale,Occasions for smoking scale (assessment scale)
273656006,Object naming test,Object naming test (assessment scale)
273654009,Nuffield dyspraxia assessment,Nuffield dyspraxia assessment (assessment scale)
273652008,Nottingham health profile,Nottingham health profile (assessment scale)
273651001,Northwick Park index of independence in ADL,Northwick Park index of independence in activities of daily living (assessment scale)
273649000,Norris functional scale,Norris functional scale (assessment scale)
273648008,Nine hole peg test,Nine hole peg test (assessment scale)
273647003,Newcastle phonology assessment,Newcastle phonology assessment (assessment scale)
273646007,Newcastle dyspraxia assessment,Newcastle dyspraxia assessment (assessment scale)
273645006,Newcastle articulation test,Newcastle articulation test (assessment scale)
273644005,Neuropsychological battery,Neuropsychological battery (assessment scale)
