code,display,definition
705032008,Occupational circumstances assessment interview and rating scale version 4.0,Occupational circumstances assessment interview and rating scale version 4.0 (assessment scale)
705031001,Lymphedema quality of life tool (leg),Lymphedema quality of life tool (leg) (assessment scale)
705030000,Lymphoedema quality of life tool (arm),Lymphedema quality of life tool (arm) (assessment scale)
705005003,Hypomania checklist 32 item revised,Hypomania checklist 32 item revised (assessment scale)
705004004,Leeds revised acne grading system,Leeds revised acne grading system (assessment scale)
705003005,Stroke impact scale version 3.0,Stroke impact scale version 3.0 (assessment scale)
704501007,Generalized Anxiety Disorder 7 item scale,Generalized Anxiety Disorder 7 item scale (assessment scale)
704500008,Framingham type B behaviour pattern measure,Framingham type B behavior pattern measure (assessment scale)
704232007,"Developmental, dimensional and diagnostic interview","Developmental, dimensional and diagnostic interview (assessment scale)"
704231000,Strong narrative assessment procedure,Strong narrative assessment procedure (assessment scale)
704230004,Wiig criterion referenced inventory of language,Wiig criterion referenced inventory of language (assessment scale)
704229009,Peter and the cat narrative assessment,Peter and the cat narrative assessment (assessment scale)
704154001,"Hypertension, abnormal renal/liver function, stroke, bleeding history or predisposition, labile international normalised ratio, elderly over 65, and drugs/alcohol concomitantly score","Hypertension, abnormal renal/liver function, stroke, bleeding history or predisposition, labile international normalized ratio, elderly over 65, and drugs/alcohol concomitantly score (assessment scale)"
703965000,Children's Communication Checklist Second Edition,Children's Communication Checklist Second Edition (assessment scale)
703964001,Phonological awareness profile,Phonological awareness profile (assessment scale)
703500002,Reaction Level Scale,Reaction Level Scale (assessment scale)
700493008,DoloTest,DoloTest (assessment scale)
699200007,Pittsburgh sleep quality index,Pittsburgh sleep quality index (assessment scale)
609368000,Frankl behavioral rating scale,Frankl behavioral rating scale (assessment scale)
473352004,Eating disorder examination questionnaire restraint subscale,Eating disorder examination questionnaire restraint subscale (assessment scale)
473351006,Eating disorder examination questionnaire weight concern subscale,Eating disorder examination questionnaire weight concern subscale (assessment scale)
473350007,Eating disorder examination questionnaire shape concern subscale,Eating disorder examination questionnaire shape concern subscale (assessment scale)
473349007,Eating disorder examination questionnaire eating concern subscale,Eating disorder examination questionnaire eating concern subscale (assessment scale)
473343008,Chronic respiratory disease questionnaire mastery subscale,Chronic respiratory disease questionnaire mastery subscale (assessment scale)
473341005,Chronic respiratory disease questionnaire fatigue subscale,Chronic respiratory disease questionnaire fatigue subscale (assessment scale)
473340006,Chronic respiratory disease questionnaire emotional function subscale,Chronic respiratory disease questionnaire emotional function subscale (assessment scale)
473339009,Chronic respiratory disease questionnaire dyspnoea subscale,Chronic respiratory disease questionnaire dyspnea subscale (assessment scale)
473326005,Ages and Stages Questionnaires Third Edition problem solving subscale,Ages and Stages Questionnaires Third Edition problem solving subscale (assessment scale)
473325009,Ages and Stages Questionnaires Third Edition personal-social subscale,Ages and Stages Questionnaires Third Edition personal-social subscale (assessment scale)
473324008,Ages and Stages Questionnaires Third Edition gross motor subscale,Ages and Stages Questionnaires Third Edition gross motor subscale (assessment scale)
473323002,Ages and Stages Questionnaires Third Edition fine motor subscale,Ages and Stages Questionnaires Third Edition fine motor subscale (assessment scale)
473322007,Ages and Stages Questionnaires Third Edition communication subscale,Ages and Stages Questionnaires Third Edition communication subscale (assessment scale)
473315004,Addenbrooke's cognitive examination revised fluency subscale,Addenbrooke's cognitive examination revised fluency subscale (assessment scale)
473314000,Addenbrooke's cognitive examination revised visuospatial subscale,Addenbrooke's cognitive examination revised visuospatial subscale (assessment scale)
473313006,Addenbrooke's cognitive examination revised memory subscale,Addenbrooke's cognitive examination revised memory subscale (assessment scale)
473312001,Addenbrooke's cognitive examination revised attention and orientation subscale,Addenbrooke's cognitive examination revised attention and orientation subscale (assessment scale)
473311008,Addenbrooke's cognitive examination revised language subscale,Addenbrooke's cognitive examination revised language subscale (assessment scale)
473298000,Psychotic symptom rating scales delusions subscale,Psychotic symptom rating scales delusions subscale (assessment scale)
473297005,Psychotic symptom rating scales auditory hallucination subscale,Psychotic symptom rating scales auditory hallucination subscale (assessment scale)
451021004,Edmonton Symptom Assessment System,Edmonton Symptom Assessment System (assessment scale)
451020003,"Family APGAR (adaptation, partnership, growth, affection, and resolve)","Family adaptation, partnership, growth, affection, and resolve (assessment scale)"
451018001,Western Ontario and McMaster Universities osteoarthritis index,Western Ontario and McMaster Universities osteoarthritis index (assessment scale)
451015003,University of Alabama at Birmingham pain behavior scale,University of Alabama at Birmingham pain behavior scale (assessment scale)
450987005,Sensory modality assessment and rehabilitation technique,Sensory modality assessment and rehabilitation technique (assessment scale)
450756001,Voice handicap index,Voice handicap index (assessment scale)
450753009,Mobility inventory for agoraphobia,Mobility inventory for agoraphobia (assessment scale)
450752004,Whooley depression screen,Whooley depression screen (assessment scale)
450750007,Conversation analysis profile for people with cognitive impairment,Conversation analysis profile for people with cognitive impairment (assessment scale)
450749007,Sexual health inventory for men,Sexual health inventory for men (assessment scale)
450744002,Action for dysphasic adults comprehension battery,Action for dysphasic adults comprehension battery (assessment scale)
450741005,National Institutes of Health stroke scale,National Institutes of Health stroke scale (assessment scale)
450740006,Children's global assessment scale,Children's global assessment scale (assessment scale)
450739009,Strengths and difficulties questionnaire,Strengths and difficulties questionnaire (assessment scale)
450736002,Thirty second chair stand test,Thirty second chair stand test (assessment scale)
450734004,Coronary artery calcium score,Coronary artery calcium score (assessment scale)
450731007,Rockall score,Rockall score (assessment scale)
450729003,World Health Organization surgical safety checklist first edition,World Health Organization surgical safety checklist first edition (assessment scale)
450726005,Impact of event scale revised,Impact of event scale revised (assessment scale)
450361001,Clinical opiate withdrawal scale,Clinical opiate withdrawal scale (assessment scale)
450357007,Benign prostatic hyperplasia impact index,Benign prostatic hyperplasia impact index (assessment scale)
450356003,Panic disorder severity scale,Panic disorder severity scale (assessment scale)
450355004,Obsessive compulsive inventory,Obsessive compulsive inventory (assessment scale)
449349006,Chronic respiratory disease questionnaire,Chronic respiratory disease questionnaire (assessment scale)
449205006,Nottingham histologic grading system,Nottingham histologic grading system (staging scale)
449159002,AVPU - alert voice pain unresponsive scale,Alert voice pain unresponsive scale (assessment scale)
448880001,Cleveland Clinic constipation score,Cleveland Clinic constipation score (assessment scale)
448702001,Minnesota sedation assessment tool,Minnesota sedation assessment tool (assessment scale)
448615001,Ages and Stages Questionnaires Third Edition,Ages and Stages Questionnaires Third Edition (assessment scale)
448586003,Society of Thoracic Surgeons risk calculator,Society of Thoracic Surgeons risk calculator (assessment scale)
448382002,European system for cardiac operative risk evaluation,European system for cardiac operative risk evaluation (assessment scale)
448236008,Revised cardiac risk index,Revised cardiac risk index (assessment scale)
448226000,Modified Aldrete score,Modified Aldrete score (assessment scale)
448051009,"Body mass, airflow obstruction, dyspnoea and exercise capacity index","Body mass, airflow obstruction, dyspnea and exercise capacity index (assessment scale)"
448002006,Royal College of Physicians 3 questions,Royal College of Physicians 3 questions (assessment scale)
447313004,Oxford shoulder score,Oxford shoulder score (assessment scale)
447312009,Oxford elbow score,Oxford elbow score (assessment scale)
447278000,Short health anxiety inventory,Short health anxiety inventory (assessment scale)
447271006,Checklist for autism in toddlers,Checklist for autism in toddlers (assessment scale)
447234009,Subgroups for targeted treatment back screening tool,Subgroups for targeted treatment back screening tool (assessment scale)
446825002,Eating disorder examination questionnaire,Eating disorder examination questionnaire (assessment scale)
446619003,Adult comorbidity evaluation-27,Adult comorbidity evaluation-27 (assessment scale)
446605003,Modified checklist for autism in toddlers,Modified checklist for autism in toddlers (assessment scale)
446330006,Penn State worry questionnaire,Penn State worry questionnaire (assessment scale)
446173005,Therapy outcome measure activity scale,Therapy outcome measure activity scale (assessment scale)
446171007,Therapy outcome measure wellbeing scale,Therapy outcome measure wellbeing scale (assessment scale)
446167009,Psychotic symptom rating scale,Psychotic symptom rating scale (assessment scale)
446161005,Therapy outcome measure carer wellbeing scale,Therapy outcome measure carer wellbeing scale (assessment scale)
446090002,Victorian Institute of Sport Assessment-Achilles questionnaire,Victorian Institute of Sport Assessment-Achilles questionnaire (assessment scale)
446088003,Modified Harris hip score,Modified Harris hip score (assessment scale)
446087008,Montgomery-Åsberg depression rating scale,Montgomery-Åsberg depression rating scale (assessment scale)
446083007,Erection hardness score,Erection hardness score (assessment scale)
445957009,Hip disability and osteoarthritis outcome score,Hip disability and osteoarthritis outcome score (assessment scale)
445956000,Manchester foot pain and disability index,Manchester foot pain and disability index (assessment scale)
445952003,International index of erectile function,International index of erectile function (assessment scale)
445883003,Therapy outcome measure impairment scale,Therapy outcome measure impairment scale (assessment scale)
445873002,European pressure ulcer advisory panel classification system,European pressure ulcer advisory panel classification system (assessment scale)
445871000,Therapy outcome measure participation scale,Therapy outcome measure participation scale (assessment scale)
445670002,Brighton paediatric early warning score scale,Brighton pediatric early warning score scale (assessment scale)
445661000,Modified early warning score scale,Modified early warning score scale (assessment scale)
445660004,Disabilities of the arm shoulder and hand outcome measurement sports performing arts module,Disabilities of the arm shoulder and hand outcome measurement sports performing arts module (assessment scale)
445619006,Adult early warning scoring system,Adult early warning scoring system (assessment scale)
445597002,Paediatric early warning score scale,Pediatric early warning score scale (assessment scale)
445532005,Visual infusion phlebitis scale,Visual infusion phlebitis scale (assessment scale)
445531003,Asthma control questionnaire,Asthma control questionnaire (assessment scale)
445484001,Marks and Mathews fear questionnaire,Marks and Mathews fear questionnaire (assessment scale)
445483007,Berlin questionnaire for sleep apnoea,Berlin questionnaire for sleep apnea (assessment scale)
445452008,Addiction Research Foundation Clinical Institute Withdrawal Assessment for Alcohol,Addiction Research Foundation Clinical Institute Withdrawal Assessment for Alcohol (assessment scale)
445414007,Canadian Study of Health and Aging clinical frailty scale,Canadian Study of Health and Aging clinical frailty scale (assessment scale)
445412006,Addenbrooke's cognitive examination revised,Addenbrooke's cognitive examination revised (assessment scale)
445315007,Geriatric depression scale 4 item form,Geriatric depression scale 4 item form (assessment scale)
445312005,Clinical chronic obstructive pulmonary disease questionnaire,Clinical chronic obstructive pulmonary disease questionnaire (assessment scale)
445195000,"Historical, clinical, risk management 20 assessing risk for violence scheme version 2","Historical, clinical, risk management 20 assessing risk for violence scheme version 2 (assessment scale)"
445193007,Early warning scoring system,Early warning scoring system (assessment scale)
445190005,Androgen deficiency in the aging male questionnaire,Androgen deficiency in the aging male questionnaire (assessment scale)
445183000,Guy's neurological disability scale,Guy's neurological disability scale (assessment scale)
445074007,Mini asthma quality of life questionnaire,Mini asthma quality of life questionnaire (assessment scale)
445071004,Carers of older people in Europe index,Carers of older people in Europe index (assessment scale)
445050009,Residual cancer burden index,Residual cancer burden index (assessment scale)
445049009,Social phobia inventory,Social phobia inventory (assessment scale)
445047006,Geriatric depression scale original long form,Geriatric depression scale original long form (assessment scale)
445041007,Geriatric depression scale short form,Geriatric depression scale short form (assessment scale)
445019007,"Confusion, urea, respiratory rate, blood pressure, 65 years of age or older score","Confusion, urea, respiratory rate, blood pressure, 65 years of age or older score (assessment scale)"
444985001,Five shot questionnaire on heavy drinking,Five shot questionnaire on heavy drinking (assessment scale)
444984002,Dynamic gait index,Dynamic gait index (assessment scale)
444876002,Harris hip score scale,Harris hip score scale (assessment scale)
444875003,Disabilities of the arm shoulder and hand questionnaire,Disabilities of the arm shoulder and hand questionnaire (assessment scale)
444781002,Timed up and go mobility test,Timed up and go mobility test (assessment scale)
444776006,Short falls efficacy scale - international,Short falls efficacy scale - international (assessment scale)
444621006,Falls risk assessment score for the elderly,Falls risk assessment score for the elderly (assessment scale)
444415004,Adolescent/adult sensory profile,Adolescent/adult sensory profile (assessment scale)
444256004,"American Joint Commission on Cancer, Cancer Staging Manual, 6th edition neoplasm staging system","American Joint Commission on Cancer, Cancer Staging Manual, 6th edition neoplasm staging system (tumor staging)"
444218000,Moberg pickup test,Moberg pickup test (assessment scale)
444063009,Broselow Luten colour coding system for paediatric weight estimation,Broselow Luten color coding system for pediatric weight estimation (assessment scale)
443830009,"American Joint Commission on Cancer, Cancer Staging Manual, 7th edition neoplasm staging system","American Joint Commission on Cancer, Cancer Staging Manual, 7th edition neoplasm staging system (tumor staging)"
443807003,EuroQoL five dimension questionnaire,EuroQoL five dimension questionnaire (assessment scale)
443728000,Disease activity score 28 joint in rheumatoid arthritis,Disease activity score 28 joint in rheumatoid arthritis (assessment scale)
443727005,Methods time measurement,Methods time measurement (assessment scale)
443709007,Adelaide coma scale,Adelaide coma scale (assessment scale)
443695004,European league against rheumatism response criteria scale,European league against rheumatism response criteria scale (assessment scale)
443636001,Cognitive assessment of Minnesota,Cognitive assessment of Minnesota (assessment scale)
443635002,Fitzpatrick classification of skin type,Fitzpatrick classification of skin type (assessment scale)
443608006,School function assessment,School function assessment (assessment scale)
443597000,Model of creative ability assessment scale,Model of creative ability assessment scale (assessment scale)
443571006,Draw a person test,Draw a person test (assessment scale)
443549001,Career interest test,Career interest test (assessment scale)
443539004,Disease activity score in rheumatoid arthritis using C-reactive protein,Disease activity score in rheumatoid arthritis using C-reactive protein (assessment scale)
443450003,Asthma control test,Asthma control test (assessment scale)
443446005,Eating disorder examination,Eating disorder examination (assessment scale)
443442007,Child occupational self assessment version 2.1,Child occupational self assessment version 2.1 (assessment scale)
443421005,Social training achievement record,Social training achievement record (assessment scale)
443397001,Evaluation tool of children's handwriting,Evaluation tool of children's handwriting (assessment scale)
443393002,Stirling eating disorders scale,Stirling eating disorders scale (assessment scale)
443372000,Functional analysis of care environments assessment tool,Functional analysis of care environments assessment tool (assessment scale)
443370008,Falls behavioural scale for older people,Falls behavioral scale for older people (assessment scale)
443364002,Modified Barthel index of activities of daily living,Modified Barthel index of activities of daily living (assessment scale)
443351003,Functional capacity evaluation,Functional capacity evaluation (assessment scale)
443350002,Kapandji clinical opposition and reposition test of thumb score,Kapandji clinical opposition and reposition test of thumb score (assessment scale)
443349002,Disease activity score in rheumatoid arthritis,Disease activity score in rheumatoid arthritis (assessment scale)
443322002,Activities specific balance confidence scale,Activities specific balance confidence scale (assessment scale)
443321009,Anorexia nervosa stages of change questionnaire,Anorexia nervosa stages of change questionnaire (assessment scale)
443319004,Sollerman hand function test,Sollerman hand function test (assessment scale)
443318007,Tinetti balance and gait scale,Tinetti balance and gait scale (assessment scale)
443316006,Quality of upper extremity skills test scale,Quality of upper extremity skills test scale (assessment scale)
443313003,Finnish diabetes risk score,Finnish diabetes risk score (assessment scale)
443289006,Michigan hand outcomes questionnaire,Michigan hand outcomes questionnaire (assessment scale)
443274002,Modular arrangement of predetermined time standards scoring tool,Modular arrangement of predetermined time standards scoring tool (assessment scale)
443270006,Single and double simultaneous tactile stimulation test,Single and double simultaneous tactile stimulation test (assessment scale)
443259004,"Confusion, Respiratory Rate, Blood Pressure, 65 years of age or older score","Confusion, Respiratory Rate, Blood Pressure, 65 years of age or older score (assessment scale)"
443251001,Sensory integration inventory revised for individuals with developmental disabilities,Sensory integration inventory revised for individuals with developmental disabilities (assessment scale)
443226002,Fatigue impact scale,Fatigue impact scale (assessment scale)
443222000,Ages and stages questionnaire second edition,Ages and stages questionnaire second edition (assessment scale)
443217000,Communication skills questionnaire,Communication skills questionnaire (assessment scale)
443204003,Benton visual retention test,Benton visual retention test (assessment scale)
443173002,Childhood health assessment questionnaire,Childhood health assessment questionnaire (assessment scale)
443169000,Large Allen cognitive level screening tool,Large Allen cognitive level screening tool (assessment scale)
443135001,Sensory profile,Sensory profile (assessment scale)
443134002,Single and double simultaneous visual stimulation test,Single and double simultaneous visual stimulation test (assessment scale)
443132003,Sequential occupational dexterity assessment,Sequential occupational dexterity assessment (assessment scale)
443124006,Frontal assessment battery,Frontal assessment battery (assessment scale)
443116001,Melbourne assessment of unilateral upper limb function,Melbourne assessment of unilateral upper limb function (assessment scale)
441941004,Edinburgh claudication questionnaire,Edinburgh claudication questionnaire (assessment scale)
441939000,International Consultation on Incontinence questionnaire,International Consultation on Incontinence questionnaire (assessment scale)
441221004,Easy care weighted disability assessment,Easy care weighted disability assessment (assessment scale)
440683003,Model of Human Occupation Screening Tool version 2.0,Model of Human Occupation Screening Tool version 2.0 (assessment scale)
440600003,Kohlman evaluation of living skills,Kohlman evaluation of living skills (assessment scale)
440528001,Westmead home safety assessment,Westmead home safety assessment (assessment scale)
440430001,Assessment of communication and interaction skill version 4.0,Assessment of communication and interaction skill version 4.0 (assessment scale)
440362002,Occupational therapy functional assessment compilation tool,Occupational therapy functional assessment compilation tool (assessment scale)
440233001,Duke older Americans resources and services instrumental activities of daily living score,Duke older Americans resources and services instrumental activities of daily living score (assessment scale)
440150009,Pool activity level instrument,Pool activity level instrument (assessment scale)
440117009,Worker role interview version 10.0,Worker role interview version 10.0 (assessment scale)
440106008,Westcotes individualized outcome measure,Westcotes individualized outcome measure (assessment scale)
440067004,Occupational therapy task observation scale,Occupational therapy task observation scale (assessment scale)
439971006,Safety assessment of function and the environment for rehabilitation,Safety assessment of function and the environment for rehabilitation (assessment scale)
439943000,Social functioning scale,Social functioning scale (assessment scale)
439924000,Occupational self assessment version 2.2,Occupational self assessment version 2.2 (assessment scale)
439829006,Work environment impact scale version 2.0,Work environment impact scale version 2.0 (assessment scale)
439827008,QRISK cardiovascular disease risk score,QRISK cardiovascular disease risk score (assessment scale)
439596001,Binary individualized outcome measure,Binary individualized outcome measure (assessment scale)
439492002,Therapy outcome measure,Therapy outcome measure (assessment scale)
439445001,Volitional questionnaire version 4.1,Volitional questionnaire version 4.1 (assessment scale)
439440006,Occupational performance history interview II version 2.1,Occupational performance history interview II version 2.1 (assessment scale)
439398004,Mayers lifestyle questionnaire 2,Mayers lifestyle questionnaire 2 (assessment scale)
439359009,Patients At Risk of Re-hospitalisation case finding tool,Patients At Risk of Re-hospitalization case finding tool (assessment scale)
439343009,Tinetti falls efficacy scale,Tinetti falls efficacy scale (assessment scale)
439327002,Functional test for the hemiparetic upper extremity,Functional test for the hemiparetic upper extremity (assessment scale)
439313007,Canadian occupational performance measure,Canadian occupational performance measure (assessment scale)
439312002,Occupational circumstances assessment interview and rating scale forensic mental health version 4.0,Occupational circumstances assessment interview and rating scale forensic mental health version 4.0 (assessment scale)
438780009,Mayers lifestyle questionnaire 1,Mayers lifestyle questionnaire 1 (assessment scale)
438776004,Community dependency index,Community dependency index (assessment scale)
438766002,Arnadottir occupational therapy activities of daily living neurobehavioural evaluation,Arnadottir occupational therapy activities of daily living neurobehavioral evaluation (assessment scale)
438622006,Perceived efficacy and goal setting system,Perceived efficacy and goal setting system (assessment scale)
438621004,Elderly Assessment System,Elderly Assessment System (assessment scale)
438502000,Occupational therapy role checklist,Occupational therapy role checklist (assessment scale)
438501007,Joint protection knowledge assessment,Joint protection knowledge assessment (assessment scale)
438367009,CHADS2 score,"Congestive heart failure, hypertension, age 75 years or older, diabetes, and previous stroke or transient ischemic attack risk score (assessment scale)"
